MCQ,Choices,Correct
Which of the following is a unifying theme in biology?,a: Cells | b: Evolution | c: Energy processing | d: Regulation of internal environments,b
What is the study of life called?,a: Chemistry | b: Physics | c: Biology | d: Geology,c
"What is the process by which organisms move, grow, and reproduce?",a: Cellular respiration | b: Photosynthesis | c: Energy processing | d: Evolution,c
Which level of organization in biology studies the anatomy and physiology of plants and animals?,a: Molecular biology | b: Evolution of populations | c: Cellular biology | d: Anatomy and physiology,d
What is the term for the immense diversity of life on Earth?,a: Biodiversity | b: Ecology | c: Genetics | d: Evolution,a
